{"version": 1,
 "schema": {"version": 1, "name": "leanprof.build-memory"},
 "sampled":
 {"samples": 498,
  "rss_sum": 5846188032,
  "rss_files":
  ["mlp/Mlp/All.lean"],
  "private_sum_plus_shared": 5846188032,
  "private_files":
  ["mlp/Mlp/All.lean"]},
 "provenance":
 {"workload":
  {"inputs": [],
   "executable": "",
   "binary_hash": null,
   "args_hash": "cbf29ce484222325",
   "args": []},
  "platform": {"target": "arm64-apple-darwin24.6.0", "os": "macos"},
  "leanprof_version": "0.1.0",
  "lean":
  {"version": "4.35.0", "commit": "eb6cafb7290e8bd5f2937522d8d804f58f02bafc"},
  "git": null,
  "created": "2026-10-28T15:36:10Z",
  "build":
  {"targets": ["Mlp"],
   "mode": "build-memory",
   "jobs": 2,
   "imports": false,
   "clean": true}},
 "platform": "macOS",
 "modules":
 [{"wall_ms": 31126,
   "start_ms": 1793201738528,
   "private_sampled": false,
   "private_peak": 899652776,
   "peak_rss": 5846188032,
   "own_rss": null,
   "own_private": null,
   "module": "Mlp.All",
   "imports_rss": null,
   "imports_private": null,
   "file":
   "mlp/Mlp/All.lean",
   "exit": 0,
   "end_ms": 1793201769655,
   "cpu_ms": 10819},
  {"wall_ms": 59709,
   "start_ms": 1793201686612,
   "private_sampled": false,
   "private_peak": 992482312,
   "peak_rss": 1887043584,
   "own_rss": null,
   "own_private": null,
   "module": "Mlp.MayerVietoris",
   "imports_rss": null,
   "imports_private": null,
   "file":
   "mlp/Mlp/MayerVietoris.lean",
   "exit": 0,
   "end_ms": 1793201746321,
   "cpu_ms": 48826},
  {"wall_ms": 36922,
   "start_ms": 1793201701381,
   "private_sampled": false,
   "private_peak": 640473448,
   "peak_rss": 1687420928,
   "own_rss": null,
   "own_private": null,
   "module": "Mlp.Tilde",
   "imports_rss": null,
   "imports_private": null,
   "file":
   "mlp/Mlp/Tilde.lean",
   "exit": 0,
   "end_ms": 1793201738304,
   "cpu_ms": 49702},
  {"wall_ms": 33203,
   "start_ms": 1793201668115,
   "private_sampled": false,
   "private_peak": 435692136,
   "peak_rss": 1381154816,
   "own_rss": null,
   "own_private": null,
   "module": "Mlp.FourierTransform",
   "imports_rss": null,
   "imports_private": null,
   "file":
   "mlp/Mlp/FourierTransform.lean",
   "exit": 0,
   "end_ms": 1793201701318,
   "cpu_ms": 20201}],
 "mem_limit":
 {"safe_jobs": 2,
  "near": [],
  "limit": 8589934592,
  "largest_shared": 4946535256,
  "largest_rss_sum": 7733231616,
  "estimated_sum": 7914835928,
  "estimated_jobs": 4},
 "max_concurrent": 2,
 "kind": "build-memory",
 "jobs": 2,
 "declarations": [],
 "cpus": 18,
 "concurrent_peak":
 {"sum_of_peaks": 7733231616, "modules": ["Mlp.All", "Mlp.MayerVietoris"]},
 "build_exit": 0,
 "budget": null}
